{
  "$schema": "https://json-schema.org/draft/2020-12/schema",
  "type": "object",
  "additionalProperties": false,
  "required": ["fault_detected", "suspect_job", "suspect_function", "explanation", "cited_evidence"],
  "properties": {
    "fault_detected": {"type": "boolean"},
    "suspect_job": {"type": ["string", "null"], "enum": ["job_1", "job_2", null]},
    "suspect_function": {"type": ["string", "null"]},
    "explanation": {"type": "string"},
    "cited_evidence": {"type": "array", "items": {"type": "string"}}
  }
}
