{"fault_detected":true,"suspect_job":"job_1","suspect_function":null,"explanation":"The two-job execution is faulty because the stipulated top-level corpus includes record n06-r06, but the upstream-to-downstream handoff supplied to Job 2 omits it from both needs and evidence_sources. Job 2 then consistently processes the seven handed-off records, so the visible fault localizes to the upstream demand/provenance job rather than the downstream coverage/priority job. The evidence does not expose an exact function name.","cited_evidence":["Top-level corpus contains n06-r06 with need 'compare selected and complete runtime evidence', demand_score 5, source_id s06, source_weight 3.","Job 2 input needs contains n06-r01, n06-r02, n06-r03, n06-r04, n06-r05, n06-r07, and n06-r08, but not n06-r06.","Job 2 input evidence_sources contains ranks for n06-r01, n06-r02, n06-r03, n06-r04, n06-r05, n06-r07, and n06-r08, but not n06-r06.","Job 2 output metadata reports consumed_handoffs ['needs','evidence_sources'] with coverage_count 7 and priority_count 7, matching the incomplete handoff."]}