{"fault_detected":true,"suspect_job":"job_1","suspect_function":"normalize","explanation":"Job 2 correctly preserves both handoffs it was given and ranks unsupported needs first in upstream-rank order. The fault is already present in Job 1's handoff: the original corpus source_weight values are not preserved, and the Job 1 needs handoff replaces them with demand_score-like values. Because the corrupted source_weight appears in the needs output before provenance assembly is consumed downstream, the supported localization is Job 1's normalize boundary, with assemble_provenance only propagating that corrupted value into evidence_sources.","cited_evidence":["Top-level input record n06-r01 has source_weight 5, but Job 1 output needs record n06-r01 has source_weight 9.","Top-level input record n06-r02 has source_weight 4, but Job 1 output needs record n06-r02 has source_weight 8.","Top-level input record n06-r08 has source_weight 2, but Job 1 output needs record n06-r08 has source_weight 3.","The normalize declaration requires preserving normalized needs with required columns and allowed corpus identifiers, while the behavioral criteria require preserving source provenance identities and weights.","Observed Job 2 consumed handoffs ['needs','evidence_sources'], produced coverage_count 8 and priority_count 8, and ranked unsupported n06-r01 then n06-r07 before covered records in upstream-rank order."]}