{"fault_detected":false,"suspect_job":null,"suspect_function":null,"explanation":"No fault is supported by the supplied evidence. Job 2 consumed both handoffs, retained the seven selected/fallback records, mapped direct coverage only on exact matching need text, ranked unsupported records first, preserved upstream provenance order via upstream_rank within unsupported and supported groups, and recommended the first priority.","cited_evidence":["Job 2 metadata lists consumed_handoffs as [\"needs\",\"evidence_sources\"] with coverage_count 7 and priority_count 7.","Coverage contains all upstream handoff record_ids: n06-r01, n06-r02, n06-r03, n06-r04, n06-r05, n06-r07, n06-r08, with unchanged need text.","Priorities rank unsupported records n06-r01 then n06-r07 before supported records, and preserve upstream_rank order 1,6,2,3,4,5,7 according to the unsupported-first rule.","Recommendation top_need is \"isolate faulty execution branches before replay\", matching priority_rank 1."]}