{"fault_detected":true,"suspect_job":"job_1","suspect_function":null,"explanation":"The downstream job correctly processed the records it received, but the upstream handoff omitted a stipulated corpus record. The top-level corpus includes n06-r01 with the highest demand_score, yet Job-2's needs and evidence_sources handoffs start at n06-r02 and contain only n06-r02 through n06-r08. Because the omission occurred before Job-2 input, the supported localization is Job-1; no exact function name is supplied in the evidence.","cited_evidence":["top_level_input.corpus includes record_id n06-r01 with demand_score 9 and need \"isolate faulty execution branches before replay\".","job_2 input.needs contains only n06-r02 through n06-r08, omitting n06-r01.","job_2 input.evidence_sources ranks only n06-r02 through n06-r08, omitting n06-r01.","pipeline_topology identifies job_upstream_demand_provenance as job_1 upstream and job_downstream_coverage_priority as job_2 downstream."]}