{"fault_detected":true,"suspect_job":"job_1","suspect_function":"assemble_provenance","explanation":"The execution contains a fault in the upstream provenance ranking. The stipulated requirement is to preserve deterministic source provenance identities, weights, and demand-descending rank order, but the evidence_sources handoff ranks the lowest demand_score records first. Job 2 then preserves that upstream provenance order correctly, so the downstream recommendation is wrong because it consumed a faulty upstream handoff.","cited_evidence":["Top-level corpus demand order is descending: n06-r01 has demand_score 9, n06-r02 8, ... n06-r08 3.","Job 2 input evidence_sources ranks n06-r08 as rank 1 and n06-r01 as rank 8, reversing demand-descending order.","Upstream function assemble_provenance sorts with key (record.get(\"demand_score\", 0), record.get(\"record_id\", \"\")), which is ascending demand_score, not demand-descending.","Job 2 priorities preserve the supplied upstream ranks within unsupported and covered groups, matching its declared downstream role."]}