{"fault_detected":true,"suspect_job":"job_1","suspect_function":null,"explanation":"Job 1 silently omitted the stipulated demand record n06-r06 even though the top-level corpus contained it and lower-scored records n06-r07 and n06-r08 were retained. The downstream job consumed the exact seven-record handoff it received and its output is consistent with that incomplete upstream input, so the supported localization is Job 1, with no exact function identified in the evidence.","cited_evidence":["Top-level corpus includes record_id n06-r06 with need \"compare selected and complete runtime evidence\", demand_score 5, source_id s06, source_weight 3.","Job 1 output metadata reports record_count 7 and evidence_source_count 7, and its needs/evidence_sources lists omit n06-r06 while retaining n06-r07 and n06-r08.","Produced handoffs show exact hash handoffs for needs and evidence_sources from job_upstream_demand_provenance to job_downstream_coverage_priority.","Job 2 input contains the same seven needs/evidence_sources from Job 1 and does not contain n06-r06."]}