{"fault_detected":true,"suspect_job":"job_2","suspect_function":null,"explanation":"Job 2 produced the correct coverage set and priority ordering, but it did not preserve upstream provenance ranks in the priority records: every priority item has upstream_rank: 0 despite the upstream handoff containing deterministic ranks 1 through 8. The evidence does not expose function-level implementation details, so exact function localization is unsupported.","cited_evidence":["Job 1 output evidence_sources preserved ranks 1-8 for source_ids s01 through s08.","Job 2 input received those evidence_sources and all eight needs as exact handoffs.","Job 2 output priorities set upstream_rank to 0 for every record, including n06-r01, n06-r07, n06-r02, n06-r03, n06-r04, n06-r05, n06-r06, and n06-r08.","Behavioural criteria require preserving deterministic source provenance identities, weights, demand-descending rank order, and ranking unsupported needs first while preserving upstream provenance order."]}