{"fault_detected":true,"suspect_job":"job_1","suspect_function":"normalize","explanation":"The execution is faulty because the stipulated top-level corpus contains qualifying record n06-r01 with demand_score 9, so it should have been selected and preserved. Job 1 output omits n06-r01 from both needs and evidence_sources, and the exact handoffs pass that already-truncated data to Job 2. The supplied Job 1 source localizes the omission to normalize: its allowed_record_ids list contains n06-r09 instead of n06-r01, causing n06-r01 to be filtered out after select_demand.","cited_evidence":["Top-level input includes record_id n06-r01 with demand_score 9, need 'isolate faulty execution branches before replay', source_id s01, source_weight 5.","Behavioural criteria require selecting all qualifying or fallback demand records and retaining only allowed record identities without silently omitting stipulated records.","Job 1 output needs and evidence_sources start at n06-r02 and contain 7 records, omitting qualifying n06-r01.","Job 1 produced exact handoffs for needs and evidence_sources to Job 2, so Job 2 consumed the already-missing record set.","In generated/protocol_2_2/upstream_demand_provenance.py, normalize defines allowed_record_ids as ['n06-r09', 'n06-r02', 'n06-r03', 'n06-r04', 'n06-r05', 'n06-r06', 'n06-r07', 'n06-r08'], excluding n06-r01."]}