{"fault_detected":true,"suspect_job":"job_1","suspect_function":"normalize","explanation":"The two-job execution is faulty because the top-level corpus contains eight qualifying demand records with demand_score >= 3, including n06-r06, but the handoff consumed by Job 2 contains only seven needs and evidence_sources, omitting n06-r06. The supplied source evidence localizes this to Job 1's normalize function: its allowed_record_ids list includes n06-r09 instead of n06-r06, so it filters out the selected n06-r06 record before the downstream handoff. Job 2 then preserves the seven records it received, so the supported localization is upstream normalize.","cited_evidence":["top_level_input corpus includes record_id n06-r06 with demand_score 5, need \"compare selected and complete runtime evidence\", source_id s06, source_weight 3.","select_demand source selects corpus rows where demand_score >= 3 or fallback_ids, so n06-r06 qualifies before normalization.","normalize source has allowed_record_ids ['n06-r01','n06-r02','n06-r03','n06-r04','n06-r05','n06-r09','n06-r07','n06-r08'] and filters normalized_df by isin(allowed_record_ids), excluding n06-r06.","Job 2 input needs and evidence_sources contain n06-r01, n06-r02, n06-r03, n06-r04, n06-r05, n06-r07, and n06-r08 only; n06-r06 is absent.","Job 2 map_coverage allowed_record_ids includes n06-r06, indicating the downstream function would have retained n06-r06 if it had been handed off."]}