{"fault_detected":true,"suspect_job":"job_1","suspect_function":"select_demand","explanation":"The execution contains a provenance-preservation fault before Job 2. The stipulated top-level corpus source_weight values were not preserved in the handoff: Job 2 received needs and evidence_sources whose source_weight values match demand_score instead. The supplied upstream source localizes this to select_demand, which populates source_weight from row.get('demand_score', 0) rather than row.get('source_weight', 0).","cited_evidence":["Behavioural criteria require preserving record_id, need, demand_score, source_id, and source_weight, and preserving source provenance identities and weights.","Top-level input has n06-r01 source_weight 5, n06-r02 source_weight 4, n06-r08 source_weight 2.","Job 2 input needs/evidence_sources has n06-r01 source_weight 9, n06-r02 source_weight 8, n06-r08 source_weight 3.","Upstream select_demand source appends {'source_weight': row.get('demand_score', 0)}."]}