{"fault_detected":true,"suspect_job":"job_1","suspect_function":"select_demand","explanation":"Job 1 omitted the stipulated demand record n06-r06 from both the needs and evidence_sources handoffs. The top-level corpus contains n06-r06 with demand_score 5, source_id s06, and source_weight 3, and the downstream capabilities include a matching capability cap-compare for the same need. Job 2 consumed the exact handoffs it was given and preserved/ranked those seven records correctly, so the observable downstream omission traces back to the upstream selection stage.","cited_evidence":["top_level_input.corpus includes record_id n06-r06 with need 'compare selected and complete runtime evidence', demand_score 5, source_id s06, source_weight 3.","job_1.output.needs and job_1.output.evidence_sources contain n06-r01 through n06-r05 plus n06-r07 and n06-r08, but omit n06-r06.","job_1.produced_handoffs show exact hash handoffs for needs and evidence_sources to job_2, and job_2.metadata.consumed_handoffs lists both handoffs.","job_2.input.capabilities includes capability_id cap-compare for need 'compare selected and complete runtime evidence', but job_2.input.needs lacks record_id n06-r06.","semantic declaration for select_demand says it selects demand records using the score threshold while keeping explicit fallback identifiers in the returned data path."]}