{"fault_detected":true,"suspect_job":"job_1","suspect_function":"assemble_provenance","explanation":"The downstream output reflects the provenance ranks it was handed, but those ranks are not demand-descending. The required behavior says source provenance rank order must be demand-descending. Job 2 consumed evidence_sources with n06-r08 ranked 1 and n06-r01 ranked 8, causing unsupported n06-r07 to outrank unsupported n06-r01. The supplied source localizes this to job_1 assemble_provenance, which sorts by demand_score ascending instead of descending.","cited_evidence":["Behavioural criterion: Preserve deterministic source provenance identities, weights, and demand-descending rank order.","Job 2 input evidence_sources ranks n06-r08 rank 1, n06-r07 rank 2, ..., n06-r01 rank 8 despite top_level_input demand_score ordering n06-r01=9 down to n06-r08=3.","assemble_provenance source: ordered_rows = sorted(rows, key=lambda record: (record.get('demand_score', 0), record.get('record_id', ''))), which sorts demand_score ascending.","Observed job 2 priorities rank unsupported n06-r07 first with upstream_rank 2 and unsupported n06-r01 second with upstream_rank 8, consistent with the bad upstream handoff rather than a downstream ranking fault."]}