{"fault_detected":true,"suspect_job":"job_1","suspect_function":"normalize","explanation":"The execution contains a fault because the top-level corpus includes qualifying demand record n06-r01 with demand_score 9, but Job 2 received needs/evidence_sources only for n06-r02 through n06-r08. The omission occurs upstream: job_1 select_demand would include all records with demand_score >= 3, including n06-r01, but job_1 normalize filters to allowed_record_ids that omit n06-r01 and instead include nonexistent n06-r09. This violates the requirement to select and retain all qualifying or fallback demand records and preserve allowed record identities. Job 2 appears to preserve and rank the handoff it actually received, so the supported localization is job_1 normalize.","cited_evidence":["top_level_input corpus contains {record_id: n06-r01, demand_score: 9, need: isolate faulty execution branches before replay, source_id: s01, source_weight: 5}.","behavioural_criteria require selecting all qualifying or fallback demand records and retaining allowed record identities without silently omitting stipulated records.","job_1 select_demand source selects corpus_df rows where demand_score >= 3 or record_id is in fallback_ids, so n06-r01 qualifies before normalization.","job_1 normalize source sets allowed_record_ids to ['n06-r09','n06-r02','n06-r03','n06-r04','n06-r05','n06-r06','n06-r07','n06-r08'], excluding n06-r01.","job_2 input needs and evidence_sources list only n06-r02 through n06-r08, demonstrating the bad handoff was already missing n06-r01 before downstream processing."]}