{"fault_detected":true,"suspect_job":"job_1","suspect_function":"assemble_provenance","explanation":"The downstream priority output has upstream_rank 0 for every record because the upstream evidence_sources handoff uses source IDs as record_id values. The evidence localizes this to assemble_provenance, whose source sets evidence_sources.record_id from source_id instead of preserving the original demand record_id. Job 2 then looks up ranks by coverage record_id, so no ranks match.","cited_evidence":["Job 1 output evidence_sources begins with {\"rank\":1,\"record_id\":\"s01\",\"source_id\":\"s01\"} while the corresponding needs record uses \"record_id\":\"n06-r01\" and \"source_id\":\"s01\".","assemble_provenance source: records.append({'record_id': record.get('source_id', ''), 'source_id': record.get('source_id', ''), 'source_weight': record.get('source_weight', 0), 'rank': index})","prioritize source builds rank_by_record_id from evidence.get('record_id', '') and assigns upstream_rank with rank_by_record_id.get(coverage.get('record_id', ''), 0).","Observed Job 2 priorities show upstream_rank: 0 for all n06-r01 through n06-r08 despite evidence_sources carrying ranks 1 through 8."]}