{"fault_detected":true,"suspect_job":"job_1","suspect_function":null,"explanation":"The execution contains a fault in the upstream provenance job. The stipulated corpus source_weight values had to be preserved, but job_1 rewrote them to match demand_score in both needs and evidence_sources. Job_2 then consumed the two handoffs it was given and its coverage, priority ordering, and recommendation are consistent with that corrupted upstream input, so the visible responsible job is job_1. No exact function name is supplied by the evidence.","cited_evidence":["Top-level input record n06-r01 has source_weight 5, but job_1 output needs/evidence_sources show source_weight 9.","Top-level input record n06-r02 has source_weight 4, but job_1 output shows source_weight 8.","Top-level input record n06-r05 has source_weight 3, but job_1 output shows source_weight 6.","Top-level input record n06-r08 has source_weight 2, but job_1 output shows source_weight 3.","Behavioural criteria require preserving source provenance identities and weights, and preserving exact upstream-to-downstream handoffs."]}