{"fault_detected":true,"suspect_job":"job_1","suspect_function":"assemble_provenance","explanation":"The two-job execution contains a fault in upstream provenance ranking. The behavioral criteria require demand-descending provenance rank order, but job_1's assemble_provenance sorts by demand_score ascending, producing evidence_sources where the lowest-demand record n06-r08 has rank 1 and highest-demand n06-r01 has rank 8. Job_2 then preserves and uses that supplied upstream rank order correctly, so the downstream ordering error is inherited from job_1.","cited_evidence":["Behavioral criterion: \"Preserve deterministic source provenance identities, weights, and demand-descending rank order.\"","job_1 assemble_provenance source: \"ordered_rows = sorted(rows, key=lambda record: (record.get('demand_score', 0), record.get('record_id', '')))\" with no descending/reverse ordering.","Observed job_2 input evidence_sources assigns rank 1 to n06-r08 with source_id s08/source_weight 2 and rank 8 to n06-r01 with source_id s01/source_weight 5, reversing the demand-score order shown in needs/top-level input.","job_2 prioritize source ranks by supplied upstream rank within unsupported groups: \"rank_by_record_id[...] = evidence.get('rank', 0)\" and sorted key includes \"record.get('upstream_rank', 0)\"."]}