{"fault_detected":true,"suspect_job":"job_1","suspect_function":null,"explanation":"The execution is faulty because the upstream job silently omitted the stipulated corpus record n06-r06. The top-level corpus includes n06-r06 with demand_score 5, need \"compare selected and complete runtime evidence\", source_id s06, and source_weight 3, but job_1 output contains only 7 needs/evidence_sources and skips from n06-r05 to n06-r07. Job_2 preserved the exact handoff it received, so the visible fault is upstream. No exact function name is provided in the evidence.","cited_evidence":["Top-level corpus contains record_id n06-r06: demand_score 5, need \"compare selected and complete runtime evidence\", source_id s06, source_weight 3.","job_1 output needs omit n06-r06 and report metadata record_count 7 despite the supplied corpus containing 8 records.","job_1 output evidence_sources omit n06-r06 and report evidence_source_count 7.","job_2 input matches job_1's omitted-record handoff, so job_2 is downstream of the faulty omission rather than the source of it."]}