{"fault_detected":true,"suspect_job":"job_1","suspect_function":"assemble_provenance","explanation":"The execution contains a fault in upstream provenance assembly. Job 1 preserved the needs records themselves in demand-descending order, but its evidence_sources ranks do not preserve the required demand-descending provenance order. Job 2 then consumed that evidence_sources handoff exactly and ranked by the provided upstream ranks, so the downstream recommendation follows the faulty upstream provenance rather than causing it.","cited_evidence":["Behavioural criteria require preserving deterministic source provenance identities, weights, and demand-descending rank order.","Top-level corpus demand order is n06-r01 score 9, n06-r02 score 8, n06-r03 score 7, n06-r04 score 6, n06-r05 score 6, n06-r06 score 5, n06-r07 score 4, n06-r08 score 3.","Job 1 evidence_sources assigns rank 1 to n06-r08 and rank 8 to n06-r01, reversing the highest and lowest demand records instead of demand-descending order.","Semantic declaration identifies job_1 function assemble_provenance as responsible for producing evidence_sources with record_id, source_id, source_weight, and rank.","Job 2 metadata shows consumed_handoffs includes both needs and evidence_sources, and its priorities use upstream_rank values from that faulty handoff."]}