{"fault_detected":false,"suspect_job":null,"suspect_function":null,"explanation":"No fault is supported by the supplied evidence. Job 1 preserved all 8 stipulated demand records and produced demand-descending provenance ranks 1 through 8. Job 2 consumed both upstream handoffs, mapped coverage against the supplied capabilities without changing record IDs or need text, retained all 8 records, ranked unsupported needs first in upstream provenance order, and recommended the first priority.","cited_evidence":["job_1 output metadata shows record_count 8 and evidence_source_count 8, with needs containing n06-r01 through n06-r08.","job_1 evidence_sources ranks n06-r01 through n06-r08 in demand-descending order from rank 1 to rank 8.","job_2 metadata consumed_handoffs is [\"needs\", \"evidence_sources\"] and coverage_count and priority_count are both 8.","job_2 coverage marks n06-r01 and n06-r07 as coverage \"none\" because no matching capabilities are supplied, and maps the other supplied needs to their matching capability_id values.","job_2 priorities place unsupported n06-r01 upstream_rank 1 before unsupported n06-r07 upstream_rank 7, then supported records in upstream_rank order, and recommendation top_need is n06-r01 with decision \"prioritize\"."]}