{"fault_detected":true,"suspect_job":"job_1","suspect_function":null,"explanation":"Job 2 correctly preserves the exact handoffs it received and ranks unsupported needs first by upstream rank. The fault is already present in Job 1: the top-level corpus contains record n06-r06 with need \"compare selected and complete runtime evidence\", demand_score 5, source_id s06, and source_weight 3, and Job 2 even has a matching capability cap-compare, but Job 1's needs and evidence_sources handoffs omit n06-r06. The evidence shows the omission occurred upstream, but it does not prove whether select_demand failed to select it or normalize dropped it later.","cited_evidence":["Top-level input includes n06-r06: demand_score 5, need \"compare selected and complete runtime evidence\", source_id s06, source_weight 3.","Job 1 output needs include n06-r01, n06-r02, n06-r03, n06-r04, n06-r05, n06-r07, and n06-r08, but not n06-r06.","Job 1 output evidence_sources likewise skips n06-r06, with ranks going from n06-r05 at rank 5 to n06-r07 at rank 6.","Job 2 input exactly matches Job 1's omitted handoffs and Job 2 metadata reports consumed_handoffs [\"needs\", \"evidence_sources\"]."]}